{
  "contract_version": "0.1.0-frozen",
  "context_pack_id": "CTX_CODEX_B_DEMO",
  "workspace_id": "WS_DEMO",
  "task": "Integrate MacroTrace with the frozen Data Resolve contract.",
  "assignee": "ROLE_B",
  "required_objects": [
    {
      "contract_version": "0.1.0-frozen",
      "object_id": "DATA_US_TREASURY_10Y",
      "version_id": "VER_DEMO_20260804",
      "object_type": "DATASET",
      "name": "10-year Treasury yield demo snapshot",
      "representation": "PARQUET",
      "schema_version": "1.0.0",
      "content_hash": "0000000000000000000000000000000000000000000000000000000000000000",
      "license_policy": "PUBLIC",
      "access_scope": "WORKSPACE:WS_DEMO",
      "content_uri": "objects/DATA_US_TREASURY_10Y/VER_DEMO_20260804/data.parquet",
      "as_of_date": "2026-08-04",
      "data_schema": {
        "time_key": "date",
        "entity_keys": [],
        "value_fields": [
          "ust10"
        ],
        "frequency": "D",
        "units": {
          "ust10": "percent"
        },
        "field_types": {
          "date": "date",
          "ust10": "float64"
        }
      },
      "lineage_refs": [
        "SRC_PUBLIC_DEMO"
      ],
      "metadata": {
        "fixture_only": true
      }
    }
  ],
  "interface_contracts": [
    "contracts/v1/data_object_ref.schema.json",
    "contracts/v1/data_resolve.schema.json",
    "contracts/v1/tool_request.schema.json",
    "contracts/v1/evidence_bundle.schema.json"
  ],
  "decisions": [
    "MacroTrace remains the registered empirical tool.",
    "The Thesis Compiler owns final conclusion states."
  ],
  "open_questions": [],
  "forbidden_changes": [
    "Do not rename DataObjectRef fields.",
    "Do not return a product-level conclusion from MacroTrace."
  ],
  "version_map": {
    "DATA_US_TREASURY_10Y": "VER_DEMO_20260804"
  },
  "token_budget": 80000,
  "generated_at": "2026-08-04T12:00:00Z",
  "pack_hash": "1111111111111111111111111111111111111111111111111111111111111111",
  "metadata": {
    "fixture_only": true
  }
}
